{
  "asset_schema_version": 1,
  "name": "test-rubin-16gpu",
  "gpu": {
    "profile": "test-rubin",
    "count": 16
  },
  "gpu_memory": {
    "runtime_reserve_fraction": 0.1,
    "runtime_reserve_bytes": 0,
    "weight_overhead_fraction": 0.0
  },
  "network": {
    "network_bandwidth_gbps": 400.0,
    "network_latency_us": 1.0,
    "intra_node_bandwidth_gbps": 14400.0
  }
}
